line_num,line_str,doc_id
2493,that in this also the tailor kept the upper hand.,18
2494,,18
2495,"The giant said: ‘If you are such a valiant fellow, come with me into our",18
2496,"cavern and spend the night with us.’ The little tailor was willing, and",18
2497,"followed him. When they went into the cave, other giants were sitting",18
2498,"there by the fire, and each of them had a roasted sheep in his hand and",18
2499,was eating it. The little tailor looked round and thought: ‘It is much,18
2500,"more spacious here than in my workshop.’ The giant showed him a bed, and",18
2501,"said he was to lie down in it and sleep. The bed, however, was too",18
2502,"big for the little tailor; he did not lie down in it, but crept into",18
2503,"a corner. When it was midnight, and the giant thought that the little",18
2504,"tailor was lying in a sound sleep, he got up, took a great iron bar,",18
2505,"cut through the bed with one blow, and thought he had finished off the",18
2506,grasshopper for good. With the earliest dawn the giants went into the,18
2507,"forest, and had quite forgotten the little tailor, when all at once he",18
2508,"walked up to them quite merrily and boldly. The giants were terrified,",18
2509,"they were afraid that he would strike them all dead, and ran away in a",18
2510,great hurry.,18
2511,,18
2512,"The little tailor went onwards, always following his own pointed nose.",18
2513,"After he had walked for a long time, he came to the courtyard of a royal",18
2514,"palace, and as he felt weary, he lay down on the grass and fell asleep.",18
2515,"Whilst he lay there, the people came and inspected him on all sides, and",18
2516,"read on his girdle: ‘Seven at one stroke.’ ‘Ah!’ said they, ‘what does",18
2517,the great warrior want here in the midst of peace? He must be a mighty,18
2518,"lord.’ They went and announced him to the king, and gave it as their",18
2519,"opinion that if war should break out, this would be a weighty and useful",18
2520,man who ought on no account to be allowed to depart. The counsel pleased,18
2521,"the king, and he sent one of his courtiers to the little tailor to offer",18
2522,him military service when he awoke. The ambassador remained standing by,18
2523,"the sleeper, waited until he stretched his limbs and opened his eyes,",18
2524,and then conveyed to him this proposal. ‘For this very reason have,18
2525,"I come here,’ the tailor replied, ‘I am ready to enter the king’s",18
2526,"service.’ He was therefore honourably received, and a special dwelling",18
2527,was assigned him.,18
2528,,18
2529,"The soldiers, however, were set against the little tailor, and wished",18
2530,him a thousand miles away. ‘What is to be the end of this?’ they said,18
2531,"among themselves. ‘If we quarrel with him, and he strikes about him,",18
2532,seven of us will fall at every blow; not one of us can stand against,18
2533,"him.’ They came therefore to a decision, betook themselves in a body to",18
2534,"the king, and begged for their dismissal. ‘We are not prepared,’ said",18
2535,"they, ‘to stay with a man who kills seven at one stroke.’ The king was",18
2536,"sorry that for the sake of one he should lose all his faithful servants,",18
2537,"wished that he had never set eyes on the tailor, and would willingly",18
2538,have been rid of him again. But he did not venture to give him his,18
2539,"dismissal, for he dreaded lest he should strike him and all his people",18
2540,"dead, and place himself on the royal throne. He thought about it for a",18
2541,"long time, and at last found good counsel. He sent to the little tailor",18
2542,"and caused him to be informed that as he was a great warrior, he had one",18
2543,"request to make to him. In a forest of his country lived two giants,",18
2544,"who caused great mischief with their robbing, murdering, ravaging,",18
2545,"and burning, and no one could approach them without putting himself in",18
2546,"danger of death. If the tailor conquered and killed these two giants, he",18
2547,"would give him his only daughter to wife, and half of his kingdom as a",18
2548,"dowry, likewise one hundred horsemen should go with him to assist him.",18
2549,‘That would indeed be a fine thing for a man like me!’ thought the,18
2550,little tailor. ‘One is not offered a beautiful princess and half a,18
2551,"kingdom every day of one’s life!’ ‘Oh, yes,’ he replied, ‘I will soon",18
2552,"subdue the giants, and do not require the help of the hundred horsemen",18
2553,to do it; he who can hit seven with one blow has no need to be afraid of,18
2554,two.’,18
2555,,18
2556,"The little tailor went forth, and the hundred horsemen followed him.",18
2557,"When he came to the outskirts of the forest, he said to his followers:",18
2558,"‘Just stay waiting here, I alone will soon finish off the giants.’ Then",18
2559,he bounded into the forest and looked about right and left. After a,18
2560,"while he perceived both giants. They lay sleeping under a tree, and",18
2561,"snored so that the branches waved up and down. The little tailor, not",18
2562,"idle, gathered two pocketsful of stones, and with these climbed up the",18
2563,"tree. When he was halfway up, he slipped down by a branch, until he sat",18
2564,"just above the sleepers, and then let one stone after another fall on",18
2565,"the breast of one of the giants. For a long time the giant felt nothing,",18
2566,"but at last he awoke, pushed his comrade, and said: ‘Why are you",18
2567,"knocking me?’ ‘You must be dreaming,’ said the other, ‘I am not knocking",18
2568,"you.’ They laid themselves down to sleep again, and then the tailor",18
2569,threw a stone down on the second. ‘What is the meaning of this?’ cried,18
2570,"the other ‘Why are you pelting me?’ ‘I am not pelting you,’ answered",18
2571,"the first, growling. They disputed about it for a time, but as they were",18
2572,"weary they let the matter rest, and their eyes closed once more. The",18
2573,"little tailor began his game again, picked out the biggest stone, and",18
2574,threw it with all his might on the breast of the first giant. ‘That,18
2575,"is too bad!’ cried he, and sprang up like a madman, and pushed his",18
2576,companion against the tree until it shook. The other paid him back in,18
2577,"the same coin, and they got into such a rage that they tore up trees and",18
2578,"belaboured each other so long, that at last they both fell down dead on",18
2579,the ground at the same time. Then the little tailor leapt down. ‘It is,18
2580,"a lucky thing,’ said he, ‘that they did not tear up the tree on which",18
2581,"I was sitting, or I should have had to sprint on to another like a",18
2582,squirrel; but we tailors are nimble.’ He drew out his sword and gave,18
2583,"each of them a couple of thrusts in the breast, and then went out to the",18
2584,horsemen and said: ‘The work is done; I have finished both of them,18
2585,"off, but it was hard work! They tore up trees in their sore need, and",18
2586,"defended themselves with them, but all that is to no purpose when a man",18
2587,"like myself comes, who can kill seven at one blow.’ ‘But are you not",18
2588,wounded?’ asked the horsemen. ‘You need not concern yourself about,18
2589,"that,’ answered the tailor, ‘they have not bent one hair of mine.’ The",18
2590,"horsemen would not believe him, and rode into the forest; there they",18
2591,"found the giants swimming in their blood, and all round about lay the",18
2592,torn-up trees.,18
2593,,18
2594,"The little tailor demanded of the king the promised reward; he, however,",18
2595,"repented of his promise, and again bethought himself how he could get",18
2596,"rid of the hero. ‘Before you receive my daughter, and the half of my",18
2597,"kingdom,’ said he to him, ‘you must perform one more heroic deed. In",18
2598,"the forest roams a unicorn which does great harm, and you must catch",18
2599,it first.’ ‘I fear one unicorn still less than two giants. Seven at one,18
2600,"blow, is my kind of affair.’ He took a rope and an axe with him, went",18
2601,"forth into the forest, and again bade those who were sent with him to",18
2602,wait outside. He had not long to seek. The unicorn soon came towards,18
2603,"him, and rushed directly on the tailor, as if it would gore him with its",18
2604,"horn without more ado. ‘Softly, softly; it can’t be done as quickly as",18
2605,"that,’ said he, and stood still and waited until the animal was quite",18
2606,"close, and then sprang nimbly behind the tree. The unicorn ran against",18
2607,"the tree with all its strength, and stuck its horn so fast in the trunk",18
2608,"that it had not the strength enough to draw it out again, and thus it",18
2609,"was caught. ‘Now, I have got the bird,’ said the tailor, and came out",18
2610,"from behind the tree and put the rope round its neck, and then with his",18
2611,"axe he hewed the horn out of the tree, and when all was ready he led the",18
2612,beast away and took it to the king.,18
2613,,18
2614,"The king still would not give him the promised reward, and made a third",18
2615,demand. Before the wedding the tailor was to catch him a wild boar that,18
2616,"made great havoc in the forest, and the huntsmen should give him their",18
2617,"help. ‘Willingly,’ said the tailor, ‘that is child’s play!’ He did not",18
2618,"take the huntsmen with him into the forest, and they were well pleased",18
2619,"that he did not, for the wild boar had several times received them in",18
2620,such a manner that they had no inclination to lie in wait for him. When,18
2621,"the boar perceived the tailor, it ran on him with foaming mouth and",18
2622,"whetted tusks, and was about to throw him to the ground, but the hero",18
2623,fled and sprang into a chapel which was near and up to the window at,18
2624,"once, and in one bound out again. The boar ran after him, but the tailor",18
2625,"ran round outside and shut the door behind it, and then the raging",18
2626,"beast, which was much too heavy and awkward to leap out of the window,",18
2627,was caught. The little tailor called the huntsmen thither that they,18
2628,"might see the prisoner with their own eyes. The hero, however, went to",18
2629,"the king, who was now, whether he liked it or not, obliged to keep his",18
2630,"promise, and gave his daughter and the half of his kingdom. Had he known",18
2631,"that it was no warlike hero, but a little tailor who was standing before",18
2632,"him, it would have gone to his heart still more than it did. The wedding",18
2633,"was held with great magnificence and small joy, and out of a tailor a",18
2634,king was made.,18
2635,,18
2636,After some time the young queen heard her husband say in his dreams at,18
2637,"night: ‘Boy, make me the doublet, and patch the pantaloons, or else I",18
2638,will rap the yard-measure over your ears.’ Then she discovered in what,18
2639,"state of life the young lord had been born, and next morning complained",18
2640,"of her wrongs to her father, and begged him to help her to get rid of",18
2641,"her husband, who was nothing else but a tailor. The king comforted her",18
2642,"and said: ‘Leave your bedroom door open this night, and my servants",18
2643,"shall stand outside, and when he has fallen asleep shall go in, bind",18
2644,"him, and take him on board a ship which shall carry him into the wide",18
2645,"world.’ The woman was satisfied with this; but the king’s armour-bearer,",18
2646,"who had heard all, was friendly with the young lord, and informed him of",18
2647,"the whole plot. ‘I’ll put a screw into that business,’ said the little",18
2648,"tailor. At night he went to bed with his wife at the usual time, and",18
2649,"when she thought that he had fallen asleep, she got up, opened the door,",18
2650,"and then lay down again. The little tailor, who was only pretending to",18
2651,"be asleep, began to cry out in a clear voice: ‘Boy, make me the doublet",18
2652,"and patch me the pantaloons, or I will rap the yard-measure over your",18
2653,"ears. I smote seven at one blow. I killed two giants, I brought away one",18
2654,"unicorn, and caught a wild boar, and am I to fear those who are standing",18
2655,"outside the room.’ When these men heard the tailor speaking thus, they",18
2656,"were overcome by a great dread, and ran as if the wild huntsman were",18
2657,"behind them, and none of them would venture anything further against",18
2658,him. So the little tailor was and remained a king to the end of his,18
2659,life.,18
2660,,18
2661,,18
2662,,18
2663,,18
2665,,19
2666,,19
2667,Hard by a great forest dwelt a poor wood-cutter with his wife and his,19
2668,two children. The boy was called Hansel and the girl Gretel. He had,19
2669,"little to bite and to break, and once when great dearth fell on the",19
2670,"land, he could no longer procure even daily bread. Now when he thought",19
2671,"over this by night in his bed, and tossed about in his anxiety, he",19
2672,groaned and said to his wife: ‘What is to become of us? How are we,19
2673,"to feed our poor children, when we no longer have anything even for",19
2674,"ourselves?’ ‘I’ll tell you what, husband,’ answered the woman, ‘early",19
2675,tomorrow morning we will take the children out into the forest to where,19
2676,"it is the thickest; there we will light a fire for them, and give each",19
2677,"of them one more piece of bread, and then we will go to our work and",19
2678,"leave them alone. They will not find the way home again, and we shall be",19
2679,"rid of them.’ ‘No, wife,’ said the man, ‘I will not do that; how can I",19
2680,bear to leave my children alone in the forest?--the wild animals would,19
2681,"soon come and tear them to pieces.’ ‘O, you fool!’ said she, ‘then we",19
2682,"must all four die of hunger, you may as well plane the planks for our",19
2683,"coffins,’ and she left him no peace until he consented. ‘But I feel very",19
2684,"sorry for the poor children, all the same,’ said the man.",19
2685,,19
2686,"The two children had also not been able to sleep for hunger, and had",19
2687,heard what their stepmother had said to their father. Gretel wept,19
2688,"bitter tears, and said to Hansel: ‘Now all is over with us.’ ‘Be quiet,",19
2689,"Gretel,’ said Hansel, ‘do not distress yourself, I will soon find a way",19
2690,"to help us.’ And when the old folks had fallen asleep, he got up, put",19
2691,"on his little coat, opened the door below, and crept outside. The moon",19
2692,"shone brightly, and the white pebbles which lay in front of the house",19
2693,glittered like real silver pennies. Hansel stooped and stuffed the,19
2694,little pocket of his coat with as many as he could get in. Then he went,19
2695,"back and said to Gretel: ‘Be comforted, dear little sister, and sleep in",19
2696,"peace, God will not forsake us,’ and he lay down again in his bed. When",19
2697,"day dawned, but before the sun had risen, the woman came and awoke the",19
2698,"two children, saying: ‘Get up, you sluggards! we are going into the",19
2699,"forest to fetch wood.’ She gave each a little piece of bread, and said:",19
2700,"‘There is something for your dinner, but do not eat it up before then,",19
2701,"for you will get nothing else.’ Gretel took the bread under her apron,",19
2702,as Hansel had the pebbles in his pocket. Then they all set out together,19
2703,"on the way to the forest. When they had walked a short time, Hansel",19
2704,"stood still and peeped back at the house, and did so again and again.",19
2705,"His father said: ‘Hansel, what are you looking at there and staying",19
2706,"behind for? Pay attention, and do not forget how to use your legs.’ ‘Ah,",19
2707,"father,’ said Hansel, ‘I am looking at my little white cat, which is",19
2708,"sitting up on the roof, and wants to say goodbye to me.’ The wife said:",19
2709,"‘Fool, that is not your little cat, that is the morning sun which is",19
2710,"shining on the chimneys.’ Hansel, however, had not been looking back at",19
2711,"the cat, but had been constantly throwing one of the white pebble-stones",19
2712,out of his pocket on the road.,19
2713,,19
2714,"When they had reached the middle of the forest, the father said: ‘Now,",19
2715,"children, pile up some wood, and I will light a fire that you may not",19
2716,"be cold.’ Hansel and Gretel gathered brushwood together, as high as a",19
2717,"little hill. The brushwood was lighted, and when the flames were burning",19
2718,"very high, the woman said: ‘Now, children, lay yourselves down by the",19
2719,"fire and rest, we will go into the forest and cut some wood. When we",19
2720,"have done, we will come back and fetch you away.’",19
2721,,19
2722,"Hansel and Gretel sat by the fire, and when noon came, each ate a little",19
2723,"piece of bread, and as they heard the strokes of the wood-axe they",19
2724,"believed that their father was near. It was not the axe, however, but",19
2725,a branch which he had fastened to a withered tree which the wind was,19
2726,blowing backwards and forwards. And as they had been sitting such a long,19
2727,"time, their eyes closed with fatigue, and they fell fast asleep. When",19
2728,"at last they awoke, it was already dark night. Gretel began to cry and",19
2729,said: ‘How are we to get out of the forest now?’ But Hansel comforted,19
2730,"her and said: ‘Just wait a little, until the moon has risen, and then we",19
2731,"will soon find the way.’ And when the full moon had risen, Hansel took",19
2732,"his little sister by the hand, and followed the pebbles which shone like",19
2733,"newly-coined silver pieces, and showed them the way.",19
2734,,19
2735,"They walked the whole night long, and by break of day came once more",19
2736,"to their father’s house. They knocked at the door, and when the woman",19
2737,"opened it and saw that it was Hansel and Gretel, she said: ‘You naughty",19
2738,"children, why have you slept so long in the forest?--we thought you were",19
2739,"never coming back at all!’ The father, however, rejoiced, for it had cut",19
2740,him to the heart to leave them behind alone.,19
2741,,19
2742,"Not long afterwards, there was once more great dearth throughout the",19
2743,"land, and the children heard their mother saying at night to their",19
2744,"father: ‘Everything is eaten again, we have one half loaf left, and that",19
2745,"is the end. The children must go, we will take them farther into the",19
2746,"wood, so that they will not find their way out again; there is no other",19
2747,"means of saving ourselves!’ The man’s heart was heavy, and he thought:",19
2748,‘It would be better for you to share the last mouthful with your,19
2749,"children.’ The woman, however, would listen to nothing that he had to",19
2750,"say, but scolded and reproached him. He who says A must say B, likewise,",19
2751,"and as he had yielded the first time, he had to do so a second time",19
2752,also.,19
2753,,19
2754,"The children, however, were still awake and had heard the conversation.",19
2755,"When the old folks were asleep, Hansel again got up, and wanted to go",19
2756,"out and pick up pebbles as he had done before, but the woman had locked",19
2757,"the door, and Hansel could not get out. Nevertheless he comforted his",19
2758,"little sister, and said: ‘Do not cry, Gretel, go to sleep quietly, the",19
2759,good God will help us.’,19
2760,,19
2761,"Early in the morning came the woman, and took the children out of their",19
2762,"beds. Their piece of bread was given to them, but it was still smaller",19
2763,than the time before. On the way into the forest Hansel crumbled his,19
2764,"in his pocket, and often stood still and threw a morsel on the ground.",19
2765,"‘Hansel, why do you stop and look round?’ said the father, ‘go on.’ ‘I",19
2766,"am looking back at my little pigeon which is sitting on the roof, and",19
2767,"wants to say goodbye to me,’ answered Hansel. ‘Fool!’ said the woman,",19
2768,"‘that is not your little pigeon, that is the morning sun that is shining",19
2769,"on the chimney.’ Hansel, however little by little, threw all the crumbs",19
2770,on the path.,19
2771,,19
2772,"The woman led the children still deeper into the forest, where they had",19
2773,"never in their lives been before. Then a great fire was again made, and",19
2774,"the mother said: ‘Just sit there, you children, and when you are tired",19
2775,"you may sleep a little; we are going into the forest to cut wood, and in",19
2776,"the evening when we are done, we will come and fetch you away.’ When",19
2777,"it was noon, Gretel shared her piece of bread with Hansel, who had",19
2778,"scattered his by the way. Then they fell asleep and evening passed, but",19
2779,no one came to the poor children. They did not awake until it was dark,19
2780,"night, and Hansel comforted his little sister and said: ‘Just wait,",19
2781,"Gretel, until the moon rises, and then we shall see the crumbs of bread",19
2782,"which I have strewn about, they will show us our way home again.’ When",19
2783,"the moon came they set out, but they found no crumbs, for the many",19
2784,thousands of birds which fly about in the woods and fields had picked,19
2785,"them all up. Hansel said to Gretel: ‘We shall soon find the way,’ but",19
2786,they did not find it. They walked the whole night and all the next day,19
2787,"too from morning till evening, but they did not get out of the forest,",19
2788,"and were very hungry, for they had nothing to eat but two or three",19
2789,"berries, which grew on the ground. And as they were so weary that their",19
2790,"legs would carry them no longer, they lay down beneath a tree and fell",19
2791,asleep.,19
2792,,19
2793,It was now three mornings since they had left their father’s house. They,19
2794,"began to walk again, but they always came deeper into the forest, and if",19
2795,"help did not come soon, they must die of hunger and weariness. When it",19
2796,"was mid-day, they saw a beautiful snow-white bird sitting on a bough,",19
2797,which sang so delightfully that they stood still and listened to it. And,19
2798,"when its song was over, it spread its wings and flew away before them,",19
2799,"and they followed it until they reached a little house, on the roof of",19
2800,which it alighted; and when they approached the little house they saw,19
2801,"that it was built of bread and covered with cakes, but that the windows",19
2802,"were of clear sugar. ‘We will set to work on that,’ said Hansel, ‘and",19
2803,"have a good meal. I will eat a bit of the roof, and you Gretel, can eat",19
2804,"some of the window, it will taste sweet.’ Hansel reached up above, and",19
2805,"broke off a little of the roof to try how it tasted, and Gretel leant",19
2806,against the window and nibbled at the panes. Then a soft voice cried,19
2807,from the parlour:,19
2808,,19
2809,"‘Nibble, nibble, gnaw,",19
2810,Who is nibbling at my little house?’,19
2811,,19
2812,The children answered:,19
2813,,19
2814,"‘The wind, the wind,",19
2815,"The heaven-born wind,’",19
2816,,19
2817,"and went on eating without disturbing themselves. Hansel, who liked the",19
2818,"taste of the roof, tore down a great piece of it, and Gretel pushed out",19
2819,"the whole of one round window-pane, sat down, and enjoyed herself with",19
2820,"it. Suddenly the door opened, and a woman as old as the hills, who",19
2821,"supported herself on crutches, came creeping out. Hansel and Gretel were",19
2822,so terribly frightened that they let fall what they had in their,19
2823,"hands. The old woman, however, nodded her head, and said: ‘Oh, you dear",19
2824,"children, who has brought you here? do come in, and stay with me. No",19
2825,"harm shall happen to you.’ She took them both by the hand, and led them",19
2826,"into her little house. Then good food was set before them, milk and",19
2827,"pancakes, with sugar, apples, and nuts. Afterwards two pretty little",19
2828,"beds were covered with clean white linen, and Hansel and Gretel lay down",19
2829,"in them, and thought they were in heaven.",19
2830,,19
2831,The old woman had only pretended to be so kind; she was in reality,19
2832,"a wicked witch, who lay in wait for children, and had only built the",19
2833,little house of bread in order to entice them there. When a child fell,19
2834,"into her power, she killed it, cooked and ate it, and that was a feast",19
2835,"day with her. Witches have red eyes, and cannot see far, but they have",19
2836,"a keen scent like the beasts, and are aware when human beings draw near.",19
2837,"When Hansel and Gretel came into her neighbourhood, she laughed with",19
2838,"malice, and said mockingly: ‘I have them, they shall not escape me",19
2839,"again!’ Early in the morning before the children were awake, she was",19
2840,"already up, and when she saw both of them sleeping and looking so",19
2841,"pretty, with their plump and rosy cheeks she muttered to herself: ‘That",19
2842,will be a dainty mouthful!’ Then she seized Hansel with her shrivelled,19
2843,"hand, carried him into a little stable, and locked him in behind a",19
2844,"grated door. Scream as he might, it would not help him. Then she went to",19
2845,"Gretel, shook her till she awoke, and cried: ‘Get up, lazy thing, fetch",19
2846,"some water, and cook something good for your brother, he is in the",19
2847,"stable outside, and is to be made fat. When he is fat, I will eat him.’",19
2848,"Gretel began to weep bitterly, but it was all in vain, for she was",19
2849,forced to do what the wicked witch commanded.,19
2850,,19
2851,"And now the best food was cooked for poor Hansel, but Gretel got nothing",19
