line_num,line_str,doc_id
126,,1
127,,1
128,"A certain king had a beautiful garden, and in the garden stood a tree",1
129,"which bore golden apples. These apples were always counted, and about",1
130,the time when they began to grow ripe it was found that every night one,1
131,"of them was gone. The king became very angry at this, and ordered the",1
132,gardener to keep watch all night under the tree. The gardener set his,1
133,"eldest son to watch; but about twelve o’clock he fell asleep, and in",1
134,the morning another of the apples was missing. Then the second son was,1
135,"ordered to watch; and at midnight he too fell asleep, and in the morning",1
136,another apple was gone. Then the third son offered to keep watch; but,1
137,"the gardener at first would not let him, for fear some harm should come",1
138,"to him: however, at last he consented, and the young man laid himself",1
139,under the tree to watch. As the clock struck twelve he heard a rustling,1
140,"noise in the air, and a bird came flying that was of pure gold; and as",1
141,"it was snapping at one of the apples with its beak, the gardener’s son",1
142,jumped up and shot an arrow at it. But the arrow did the bird no harm;,1
143,"only it dropped a golden feather from its tail, and then flew away.",1
144,"The golden feather was brought to the king in the morning, and all the",1
145,council was called together. Everyone agreed that it was worth more than,1
146,"all the wealth of the kingdom: but the king said, ‘One feather is of no",1
147,"use to me, I must have the whole bird.’",1
148,,1
149,Then the gardener’s eldest son set out and thought to find the golden,1
150,"bird very easily; and when he had gone but a little way, he came to a",1
151,"wood, and by the side of the wood he saw a fox sitting; so he took his",1
152,"bow and made ready to shoot at it. Then the fox said, ‘Do not shoot me,",1
153,"for I will give you good counsel; I know what your business is, and",1
154,that you want to find the golden bird. You will reach a village in the,1
155,"evening; and when you get there, you will see two inns opposite to each",1
156,"other, one of which is very pleasant and beautiful to look at: go not in",1
157,"there, but rest for the night in the other, though it may appear to you",1
158,"to be very poor and mean.’ But the son thought to himself, ‘What can",1
159,such a beast as this know about the matter?’ So he shot his arrow at,1
160,"the fox; but he missed it, and it set up its tail above its back and",1
161,"ran into the wood. Then he went his way, and in the evening came to",1
162,the village where the two inns were; and in one of these were people,1
163,"singing, and dancing, and feasting; but the other looked very dirty,",1
164,"and poor. ‘I should be very silly,’ said he, ‘if I went to that shabby",1
165,"house, and left this charming place’; so he went into the smart house,",1
166,"and ate and drank at his ease, and forgot the bird, and his country too.",1
167,,1
168,"Time passed on; and as the eldest son did not come back, and no tidings",1
169,"were heard of him, the second son set out, and the same thing happened",1
170,"to him. He met the fox, who gave him the good advice: but when he came",1
171,"to the two inns, his eldest brother was standing at the window where",1
172,"the merrymaking was, and called to him to come in; and he could not",1
173,"withstand the temptation, but went in, and forgot the golden bird and",1
174,his country in the same manner.,1
175,,1
176,"Time passed on again, and the youngest son too wished to set out into",1
177,the wide world to seek for the golden bird; but his father would not,1
178,"listen to it for a long while, for he was very fond of his son, and",1
179,"was afraid that some ill luck might happen to him also, and prevent his",1
180,"coming back. However, at last it was agreed he should go, for he would",1
181,"not rest at home; and as he came to the wood, he met the fox, and heard",1
182,"the same good counsel. But he was thankful to the fox, and did not",1
183,"attempt his life as his brothers had done; so the fox said, ‘Sit upon my",1
184,"tail, and you will travel faster.’ So he sat down, and the fox began to",1
185,"run, and away they went over stock and stone so quick that their hair",1
186,whistled in the wind.,1
187,,1
188,"When they came to the village, the son followed the fox’s counsel, and",1
189,without looking about him went to the shabby inn and rested there all,1
190,night at his ease. In the morning came the fox again and met him as he,1
191,"was beginning his journey, and said, ‘Go straight forward, till you come",1
192,"to a castle, before which lie a whole troop of soldiers fast asleep and",1
193,"snoring: take no notice of them, but go into the castle and pass on and",1
194,"on till you come to a room, where the golden bird sits in a wooden cage;",1
195,close by it stands a beautiful golden cage; but do not try to take the,1
196,"bird out of the shabby cage and put it into the handsome one, otherwise",1
197,"you will repent it.’ Then the fox stretched out his tail again, and the",1
198,"young man sat himself down, and away they went over stock and stone till",1
199,their hair whistled in the wind.,1
200,,1
201,Before the castle gate all was as the fox had said: so the son went in,1
202,"and found the chamber where the golden bird hung in a wooden cage, and",1
203,"below stood the golden cage, and the three golden apples that had been",1
204,"lost were lying close by it. Then thought he to himself, ‘It will be a",1
205,very droll thing to bring away such a fine bird in this shabby cage’; so,1
206,he opened the door and took hold of it and put it into the golden cage.,1
207,"But the bird set up such a loud scream that all the soldiers awoke, and",1
208,they took him prisoner and carried him before the king. The next morning,1
209,"the court sat to judge him; and when all was heard, it sentenced him to",1
210,"die, unless he should bring the king the golden horse which could run as",1
211,"swiftly as the wind; and if he did this, he was to have the golden bird",1
212,given him for his own.,1
213,,1
214,"So he set out once more on his journey, sighing, and in great despair,",1
215,"when on a sudden his friend the fox met him, and said, ‘You see now",1
216,what has happened on account of your not listening to my counsel. I will,1
217,"still, however, tell you how to find the golden horse, if you will do as",1
218,I bid you. You must go straight on till you come to the castle where the,1
219,horse stands in his stall: by his side will lie the groom fast asleep,1
220,"and snoring: take away the horse quietly, but be sure to put the old",1
221,"leathern saddle upon him, and not the golden one that is close by it.’",1
222,"Then the son sat down on the fox’s tail, and away they went over stock",1
223,and stone till their hair whistled in the wind.,1
224,,1
225,"All went right, and the groom lay snoring with his hand upon the golden",1
226,"saddle. But when the son looked at the horse, he thought it a great pity",1
227,"to put the leathern saddle upon it. ‘I will give him the good one,’",1
228,said he; ‘I am sure he deserves it.’ As he took up the golden saddle the,1
229,"groom awoke and cried out so loud, that all the guards ran in and took",1
230,"him prisoner, and in the morning he was again brought before the court",1
231,"to be judged, and was sentenced to die. But it was agreed, that, if he",1
232,"could bring thither the beautiful princess, he should live, and have the",1
233,bird and the horse given him for his own.,1
234,,1
235,"Then he went his way very sorrowful; but the old fox came and said, ‘Why",1
236,"did not you listen to me? If you had, you would have carried away",1
237,both the bird and the horse; yet will I once more give you counsel. Go,1
238,"straight on, and in the evening you will arrive at a castle. At twelve",1
239,o’clock at night the princess goes to the bathing-house: go up to her,1
240,"and give her a kiss, and she will let you lead her away; but take care",1
241,you do not suffer her to go and take leave of her father and mother.’,1
242,"Then the fox stretched out his tail, and so away they went over stock",1
243,and stone till their hair whistled again.,1
244,,1
245,"As they came to the castle, all was as the fox had said, and at twelve",1
246,o’clock the young man met the princess going to the bath and gave her the,1
247,"kiss, and she agreed to run away with him, but begged with many tears",1
248,"that he would let her take leave of her father. At first he refused,",1
249,"but she wept still more and more, and fell at his feet, till at last",1
250,he consented; but the moment she came to her father’s house the guards,1
251,awoke and he was taken prisoner again.,1
252,,1
253,"Then he was brought before the king, and the king said, ‘You shall never",1
254,have my daughter unless in eight days you dig away the hill that stops,1
255,the view from my window.’ Now this hill was so big that the whole world,1
256,"could not take it away: and when he had worked for seven days, and had",1
257,"done very little, the fox came and said. ‘Lie down and go to sleep; I",1
258,will work for you.’ And in the morning he awoke and the hill was gone;,1
259,"so he went merrily to the king, and told him that now that it was",1
260,removed he must give him the princess.,1
261,,1
262,"Then the king was obliged to keep his word, and away went the young man",1
263,"and the princess; and the fox came and said to him, ‘We will have all",1
264,"three, the princess, the horse, and the bird.’ ‘Ah!’ said the young man,",1
265,"‘that would be a great thing, but how can you contrive it?’",1
266,,1
267,"‘If you will only listen,’ said the fox, ‘it can be done. When you come",1
268,"to the king, and he asks for the beautiful princess, you must say, “Here",1
269,she is!” Then he will be very joyful; and you will mount the golden,1
270,"horse that they are to give you, and put out your hand to take leave of",1
271,them; but shake hands with the princess last. Then lift her quickly on,1
272,"to the horse behind you; clap your spurs to his side, and gallop away as",1
273,fast as you can.’,1
274,,1
275,"All went right: then the fox said, ‘When you come to the castle where",1
276,"the bird is, I will stay with the princess at the door, and you will",1
277,ride in and speak to the king; and when he sees that it is the right,1
278,"horse, he will bring out the bird; but you must sit still, and say that",1
279,"you want to look at it, to see whether it is the true golden bird; and",1
280,"when you get it into your hand, ride away.’",1
281,,1
282,"This, too, happened as the fox said; they carried off the bird, the",1
283,"princess mounted again, and they rode on to a great wood. Then the fox",1
284,"came, and said, ‘Pray kill me, and cut off my head and my feet.’ But the",1
285,"young man refused to do it: so the fox said, ‘I will at any rate give",1
286,"you good counsel: beware of two things; ransom no one from the gallows,",1
287,"and sit down by the side of no river.’ Then away he went. ‘Well,’",1
288,"thought the young man, ‘it is no hard matter to keep that advice.’",1
289,,1
290,"He rode on with the princess, till at last he came to the village where",1
291,he had left his two brothers. And there he heard a great noise and,1
292,"uproar; and when he asked what was the matter, the people said, ‘Two men",1
293,"are going to be hanged.’ As he came nearer, he saw that the two men were",1
294,"his brothers, who had turned robbers; so he said, ‘Cannot they in any",1
295,"way be saved?’ But the people said ‘No,’ unless he would bestow all his",1
296,money upon the rascals and buy their liberty. Then he did not stay to,1
297,"think about the matter, but paid what was asked, and his brothers were",1
298,"given up, and went on with him towards their home.",1
299,,1
300,"And as they came to the wood where the fox first met them, it was so",1
301,"cool and pleasant that the two brothers said, ‘Let us sit down by the",1
302,"side of the river, and rest a while, to eat and drink.’ So he said,",1
303,"‘Yes,’ and forgot the fox’s counsel, and sat down on the side of the",1
304,"river; and while he suspected nothing, they came behind, and threw him",1
305,"down the bank, and took the princess, the horse, and the bird, and went",1
306,"home to the king their master, and said. ‘All this have we won by our",1
307,labour.’ Then there was great rejoicing made; but the horse would not,1
308,"eat, the bird would not sing, and the princess wept.",1
309,,1
310,The youngest son fell to the bottom of the river’s bed: luckily it was,1
311,"nearly dry, but his bones were almost broken, and the bank was so steep",1
312,"that he could find no way to get out. Then the old fox came once more,",1
313,and scolded him for not following his advice; otherwise no evil would,1
314,"have befallen him: ‘Yet,’ said he, ‘I cannot leave you here, so lay hold",1
315,"of my tail and hold fast.’ Then he pulled him out of the river, and said",1
316,"to him, as he got upon the bank, ‘Your brothers have set watch to kill",1
317,"you, if they find you in the kingdom.’ So he dressed himself as a poor",1
318,"man, and came secretly to the king’s court, and was scarcely within the",1
319,"doors when the horse began to eat, and the bird to sing, and the princess",1
320,"left off weeping. Then he went to the king, and told him all his",1
321,"brothers’ roguery; and they were seized and punished, and he had the",1
322,princess given to him again; and after the king’s death he was heir to,1
323,his kingdom.,1
324,,1
325,"A long while after, he went to walk one day in the wood, and the old fox",1
326,"met him, and besought him with tears in his eyes to kill him, and cut",1
327,"off his head and feet. And at last he did so, and in a moment the",1
328,"fox was changed into a man, and turned out to be the brother of the",1
329,"princess, who had been lost a great many many years.",1
330,,1
331,,1
332,,1
333,,1
335,,2
336,,2
337,Some men are born to good luck: all they do or try to do comes,2
338,right--all that falls to them is so much gain--all their geese are,2
339,"swans--all their cards are trumps--toss them which way you will, they",2
340,"will always, like poor puss, alight upon their legs, and only move on so",2
341,much the faster. The world may very likely not always think of them as,2
342,"they think of themselves, but what care they for the world? what can it",2
343,know about the matter?,2
344,,2
345,One of these lucky beings was neighbour Hans. Seven long years he had,2
346,"worked hard for his master. At last he said, ‘Master, my time is up; I",2
347,must go home and see my poor mother once more: so pray pay me my wages,2
348,"and let me go.’ And the master said, ‘You have been a faithful and good",2
349,"servant, Hans, so your pay shall be handsome.’ Then he gave him a lump",2
350,of silver as big as his head.,2
351,,2
352,"Hans took out his pocket-handkerchief, put the piece of silver into it,",2
353,"threw it over his shoulder, and jogged off on his road homewards. As he",2
354,"went lazily on, dragging one foot after another, a man came in sight,",2
355,"trotting gaily along on a capital horse. ‘Ah!’ said Hans aloud, ‘what a",2
356,fine thing it is to ride on horseback! There he sits as easy and happy,2
357,"as if he was at home, in the chair by his fireside; he trips against no",2
358,"stones, saves shoe-leather, and gets on he hardly knows how.’ Hans did",2
359,"not speak so softly but the horseman heard it all, and said, ‘Well,",2
360,"friend, why do you go on foot then?’ ‘Ah!’ said he, ‘I have this load to",2
361,"carry: to be sure it is silver, but it is so heavy that I can’t hold up",2
362,"my head, and you must know it hurts my shoulder sadly.’ ‘What do you say",2
363,"of making an exchange?’ said the horseman. ‘I will give you my horse,",2
364,and you shall give me the silver; which will save you a great deal of,2
365,trouble in carrying such a heavy load about with you.’ ‘With all my,2
366,"heart,’ said Hans: ‘but as you are so kind to me, I must tell you one",2
367,thing--you will have a weary task to draw that silver about with you.’,2
368,"However, the horseman got off, took the silver, helped Hans up, gave him",2
369,"the bridle into one hand and the whip into the other, and said, ‘When",2
370,"you want to go very fast, smack your lips loudly together, and cry",2
371,“Jip!”’,2
372,,2
373,"Hans was delighted as he sat on the horse, drew himself up, squared his",2
374,"elbows, turned out his toes, cracked his whip, and rode merrily off, one",2
375,"minute whistling a merry tune, and another singing,",2
376,,2
377,"‘No care and no sorrow,",2
378,A fig for the morrow!,2
379,"We’ll laugh and be merry,",2
380,Sing neigh down derry!’,2
381,,2
382,"After a time he thought he should like to go a little faster, so he",2
383,smacked his lips and cried ‘Jip!’ Away went the horse full gallop; and,2
384,"before Hans knew what he was about, he was thrown off, and lay on his",2
385,"back by the road-side. His horse would have ran off, if a shepherd who",2
386,"was coming by, driving a cow, had not stopped it. Hans soon came to",2
387,"himself, and got upon his legs again, sadly vexed, and said to the",2
388,"shepherd, ‘This riding is no joke, when a man has the luck to get upon",2
389,a beast like this that stumbles and flings him off as if it would break,2
390,"his neck. However, I’m off now once for all: I like your cow now a great",2
391,"deal better than this smart beast that played me this trick, and has",2
392,"spoiled my best coat, you see, in this puddle; which, by the by, smells",2
393,not very like a nosegay. One can walk along at one’s leisure behind that,2
394,"cow--keep good company, and have milk, butter, and cheese, every day,",2
395,"into the bargain. What would I give to have such a prize!’ ‘Well,’ said",2
396,"the shepherd, ‘if you are so fond of her, I will change my cow for your",2
397,"horse; I like to do good to my neighbours, even though I lose by it",2
398,"myself.’ ‘Done!’ said Hans, merrily. ‘What a noble heart that good man",2
399,"has!’ thought he. Then the shepherd jumped upon the horse, wished Hans",2
400,"and the cow good morning, and away he rode.",2
401,,2
402,"Hans brushed his coat, wiped his face and hands, rested a while, and",2
403,"then drove off his cow quietly, and thought his bargain a very lucky",2
404,one. ‘If I have only a piece of bread (and I certainly shall always be,2
405,"able to get that), I can, whenever I like, eat my butter and cheese with",2
406,it; and when I am thirsty I can milk my cow and drink the milk: and what,2
407,"can I wish for more?’ When he came to an inn, he halted, ate up all his",2
408,"bread, and gave away his last penny for a glass of beer. When he had",2
409,"rested himself he set off again, driving his cow towards his mother’s",2
410,"village. But the heat grew greater as soon as noon came on, till at",2
411,"last, as he found himself on a wide heath that would take him more than",2
412,"an hour to cross, he began to be so hot and parched that his tongue",2
413,"clave to the roof of his mouth. ‘I can find a cure for this,’ thought",2
414,he; ‘now I will milk my cow and quench my thirst’: so he tied her to the,2
415,"stump of a tree, and held his leathern cap to milk into; but not a drop",2
416,"was to be had. Who would have thought that this cow, which was to bring",2
417,"him milk and butter and cheese, was all that time utterly dry? Hans had",2
418,not thought of looking to that.,2
419,,2
420,"While he was trying his luck in milking, and managing the matter very",2
421,"clumsily, the uneasy beast began to think him very troublesome; and at",2
422,last gave him such a kick on the head as knocked him down; and there he,2
423,"lay a long while senseless. Luckily a butcher soon came by, driving a",2
424,"pig in a wheelbarrow. ‘What is the matter with you, my man?’ said the",2
425,"butcher, as he helped him up. Hans told him what had happened, how he",2
426,"was dry, and wanted to milk his cow, but found the cow was dry too. Then",2
427,"the butcher gave him a flask of ale, saying, ‘There, drink and refresh",2
428,yourself; your cow will give you no milk: don’t you see she is an old,2
429,"beast, good for nothing but the slaughter-house?’ ‘Alas, alas!’ said",2
430,"Hans, ‘who would have thought it? What a shame to take my horse, and",2
431,"give me only a dry cow! If I kill her, what will she be good for? I hate",2
432,cow-beef; it is not tender enough for me. If it were a pig now--like,2
433,that fat gentleman you are driving along at his ease--one could do,2
434,"something with it; it would at any rate make sausages.’ ‘Well,’ said",2
435,"the butcher, ‘I don’t like to say no, when one is asked to do a kind,",2
436,"neighbourly thing. To please you I will change, and give you my fine fat",2
437,pig for the cow.’ ‘Heaven reward you for your kindness and self-denial!’,2
438,"said Hans, as he gave the butcher the cow; and taking the pig off the",2
439,"wheel-barrow, drove it away, holding it by the string that was tied to",2
440,its leg.,2
441,,2
442,"So on he jogged, and all seemed now to go right with him: he had met",2
443,"with some misfortunes, to be sure; but he was now well repaid for all.",2
444,How could it be otherwise with such a travelling companion as he had at,2
445,last got?,2
446,,2
447,The next man he met was a countryman carrying a fine white goose. The,2
448,countryman stopped to ask what was o’clock; this led to further chat;,2
449,"and Hans told him all his luck, how he had so many good bargains, and",2
450,how all the world went gay and smiling with him. The countryman then,2
451,"began to tell his tale, and said he was going to take the goose to a",2
452,"christening. ‘Feel,’ said he, ‘how heavy it is, and yet it is only eight",2
453,"weeks old. Whoever roasts and eats it will find plenty of fat upon it,",2
454,"it has lived so well!’ ‘You’re right,’ said Hans, as he weighed it in",2
455,"his hand; ‘but if you talk of fat, my pig is no trifle.’ Meantime the",2
456,"countryman began to look grave, and shook his head. ‘Hark ye!’ said he,",2
457,"‘my worthy friend, you seem a good sort of fellow, so I can’t help doing",2
458,you a kind turn. Your pig may get you into a scrape. In the village I,2
459,"just came from, the squire has had a pig stolen out of his sty. I was",2
460,dreadfully afraid when I saw you that you had got the squire’s pig. If,2
461,"you have, and they catch you, it will be a bad job for you. The least",2
462,they will do will be to throw you into the horse-pond. Can you swim?’,2
463,,2
464,"Poor Hans was sadly frightened. ‘Good man,’ cried he, ‘pray get me out",2
465,of this scrape. I know nothing of where the pig was either bred or born;,2
466,but he may have been the squire’s for aught I can tell: you know this,2
467,"country better than I do, take my pig and give me the goose.’ ‘I ought",2
468,"to have something into the bargain,’ said the countryman; ‘give a fat",2
469,"goose for a pig, indeed! ‘Tis not everyone would do so much for you as",2
470,"that. However, I will not be hard upon you, as you are in trouble.’ Then",2
471,"he took the string in his hand, and drove off the pig by a side path;",2
472,"while Hans went on the way homewards free from care. ‘After all,’",2
473,"thought he, ‘that chap is pretty well taken in. I don’t care whose pig",2
474,"it is, but wherever it came from it has been a very good friend to me. I",2
475,have much the best of the bargain. First there will be a capital roast;,2
476,then the fat will find me in goose-grease for six months; and then there,2
477,"are all the beautiful white feathers. I will put them into my pillow,",2
478,and then I am sure I shall sleep soundly without rocking. How happy my,2
479,"mother will be! Talk of a pig, indeed! Give me a fine fat goose.’",2
480,,2
481,"As he came to the next village, he saw a scissor-grinder with his wheel,",2
482,"working and singing,",2
483,,2
484,‘O’er hill and o’er dale,2
485,"So happy I roam,",2
486,"Work light and live well,",2
487,All the world is my home;,2
488,"Then who so blythe, so merry as I?’",2
489,,2
490,"Hans stood looking on for a while, and at last said, ‘You must be well",2
491,"off, master grinder! you seem so happy at your work.’ ‘Yes,’ said the",2
492,"other, ‘mine is a golden trade; a good grinder never puts his hand",2
493,into his pocket without finding money in it--but where did you get that,2
494,"beautiful goose?’ ‘I did not buy it, I gave a pig for it.’ ‘And where",2
495,did you get the pig?’ ‘I gave a cow for it.’ ‘And the cow?’ ‘I gave a,2
496,horse for it.’ ‘And the horse?’ ‘I gave a lump of silver as big as my,2
497,head for it.’ ‘And the silver?’ ‘Oh! I worked hard for that seven long,2
498,"years.’ ‘You have thriven well in the world hitherto,’ said the grinder,",2
499,‘now if you could find money in your pocket whenever you put your hand,2
500,"in it, your fortune would be made.’ ‘Very true: but how is that to be",2
501,"managed?’ ‘How? Why, you must turn grinder like myself,’ said the other;",2
502,‘you only want a grindstone; the rest will come of itself. Here is one,2
503,that is but little the worse for wear: I would not ask more than the,2
504,value of your goose for it--will you buy?’ ‘How can you ask?’ said,2
505,"Hans; ‘I should be the happiest man in the world, if I could have money",2
