line_num,line_str,doc_id
6826,I shall drive there in my carriage at two o’clock in the afternoon for,48
6827,"three successive days; the first day it will be drawn by four white, the",48
6828,"second by four chestnut, and the last by four black horses; but if you",48
6829,"fail to keep awake and I find you sleeping, I shall not be set free.’",48
6830,,48
6831,"The man promised to do all that she wished, but the raven said, ‘Alas! I",48
6832,know even now that you will take something from the woman and be unable,48
6833,to save me.’ The man assured her again that he would on no account touch,48
6834,a thing to eat or drink.,48
6835,,48
6836,"When he came to the house and went inside, the old woman met him, and",48
6837,"said, ‘Poor man! how tired you are! Come in and rest and let me give you",48
6838,something to eat and drink.’,48
6839,,48
6840,"‘No,’ answered the man, ‘I will neither eat not drink.’",48
6841,,48
6842,"But she would not leave him alone, and urged him saying, ‘If you will",48
6843,"not eat anything, at least you might take a draught of wine; one drink",48
6844,"counts for nothing,’ and at last he allowed himself to be persuaded, and",48
6845,drank.,48
6846,,48
6847,"As it drew towards the appointed hour, he went outside into the garden",48
6848,and mounted the tan-heap to await the raven. Suddenly a feeling of,48
6849,"fatigue came over him, and unable to resist it, he lay down for a little",48
6850,"while, fully determined, however, to keep awake; but in another minute",48
6851,"his eyes closed of their own accord, and he fell into such a deep sleep,",48
6852,that all the noises in the world would not have awakened him. At two,48
6853,"o’clock the raven came driving along, drawn by her four white horses;",48
6854,"but even before she reached the spot, she said to herself, sighing, ‘I",48
6855,"know he has fallen asleep.’ When she entered the garden, there she found",48
6856,"him as she had feared, lying on the tan-heap, fast asleep. She got out",48
6857,"of her carriage and went to him; she called him and shook him, but it",48
6858,"was all in vain, he still continued sleeping.",48
6859,,48
6860,"The next day at noon, the old woman came to him again with food and",48
6861,"drink which he at first refused. At last, overcome by her persistent",48
6862,"entreaties that he would take something, he lifted the glass and drank",48
6863,again.,48
6864,,48
6865,Towards two o’clock he went into the garden and on to the tan-heap to,48
6866,watch for the raven. He had not been there long before he began to feel,48
6867,"so tired that his limbs seemed hardly able to support him, and he could",48
6868,not stand upright any longer; so again he lay down and fell fast asleep.,48
6869,"As the raven drove along her four chestnut horses, she said sorrowfully",48
6870,"to herself, ‘I know he has fallen asleep.’ She went as before to look",48
6871,"for him, but he slept, and it was impossible to awaken him.",48
6872,,48
6873,"The following day the old woman said to him, ‘What is this? You are not",48
6874,"eating or drinking anything, do you want to kill yourself?’",48
6875,,48
6876,"He answered, ‘I may not and will not either eat or drink.’",48
6877,,48
6878,"But she put down the dish of food and the glass of wine in front of him,",48
6879,"and when he smelt the wine, he was unable to resist the temptation, and",48
6880,took a deep draught.,48
6881,,48
6882,When the hour came round again he went as usual on to the tan-heap in,48
6883,"the garden to await the king’s daughter, but he felt even more overcome",48
6884,"with weariness than on the two previous days, and throwing himself down,",48
6885,"he slept like a log. At two o’clock the raven could be seen approaching,",48
6886,"and this time her coachman and everything about her, as well as her",48
6887,"horses, were black.",48
6888,,48
6889,"She was sadder than ever as she drove along, and said mournfully, ‘I",48
6890,"know he has fallen asleep, and will not be able to set me free.’ She",48
6891,"found him sleeping heavily, and all her efforts to awaken him were of no",48
6892,"avail. Then she placed beside him a loaf, and some meat, and a flask",48
6893,"of wine, of such a kind, that however much he took of them, they would",48
6894,"never grow less. After that she drew a gold ring, on which her name was",48
6895,"engraved, off her finger, and put it upon one of his. Finally, she laid",48
6896,"a letter near him, in which, after giving him particulars of the food",48
6897,"and drink she had left for him, she finished with the following words:",48
6898,‘I see that as long as you remain here you will never be able to set me,48
6899,"free; if, however, you still wish to do so, come to the golden castle",48
6900,of Stromberg; this is well within your power to accomplish.’ She then,48
6901,returned to her carriage and drove to the golden castle of Stromberg.,48
6902,,48
6903,"When the man awoke and found that he had been sleeping, he was grieved",48
6904,"at heart, and said, ‘She has no doubt been here and driven away again,",48
6905,and it is now too late for me to save her.’ Then his eyes fell on the,48
6906,"things which were lying beside him; he read the letter, and knew from it",48
6907,"all that had happened. He rose up without delay, eager to start on his",48
6908,"way and to reach the castle of Stromberg, but he had no idea in which",48
6909,direction he ought to go. He travelled about a long time in search of it,48
6910,"and came at last to a dark forest, through which he went on walking for",48
6911,fourteen days and still could not find a way out. Once more the night,48
6912,"came on, and worn out he lay down under a bush and fell asleep. Again",48
6913,"the next day he pursued his way through the forest, and that evening,",48
6914,"thinking to rest again, he lay down as before, but he heard such a",48
6915,howling and wailing that he found it impossible to sleep. He waited till,48
6916,"it was darker and people had begun to light up their houses, and then",48
6917,"seeing a little glimmer ahead of him, he went towards it.",48
6918,,48
6919,He found that the light came from a house which looked smaller than,48
6920,"it really was, from the contrast of its height with that of an immense",48
6921,"giant who stood in front of it. He thought to himself, ‘If the giant",48
6922,"sees me going in, my life will not be worth much.’ However, after a",48
6923,"while he summoned up courage and went forward. When the giant saw him,",48
6924,"he called out, ‘It is lucky for that you have come, for I have not had",48
6925,anything to eat for a long time. I can have you now for my supper.’ ‘I,48
6926,"would rather you let that alone,’ said the man, ‘for I do not willingly",48
6927,give myself up to be eaten; if you are wanting food I have enough to,48
6928,"satisfy your hunger.’ ‘If that is so,’ replied the giant, ‘I will leave",48
6929,you in peace; I only thought of eating you because I had nothing else.’,48
6930,,48
6931,"So they went indoors together and sat down, and the man brought out the",48
6932,"bread, meat, and wine, which although he had eaten and drunk of them,",48
6933,"were still unconsumed. The giant was pleased with the good cheer, and",48
6934,ate and drank to his heart’s content. When he had finished his supper,48
6935,the man asked him if he could direct him to the castle of Stromberg.,48
6936,"The giant said, ‘I will look on my map; on it are marked all the towns,",48
6937,"villages, and houses.’ So he fetched his map, and looked for the castle,",48
6938,"but could not find it. ‘Never mind,’ he said, ‘I have larger maps",48
6939,"upstairs in the cupboard, we will look on those,’ but they searched in",48
6940,"vain, for the castle was not marked even on these. The man now thought",48
6941,"he should like to continue his journey, but the giant begged him to",48
6942,"remain for a day or two longer until the return of his brother, who was",48
6943,"away in search of provisions. When the brother came home, they asked him",48
6944,"about the castle of Stromberg, and he told them he would look on his own",48
6945,"maps as soon as he had eaten and appeased his hunger. Accordingly, when",48
6946,"he had finished his supper, they all went up together to his room and",48
6947,"looked through his maps, but the castle was not to be found. Then he",48
6948,"fetched other older maps, and they went on looking for the castle until",48
6949,"at last they found it, but it was many thousand miles away. ‘How shall I",48
6950,"be able to get there?’ asked the man. ‘I have two hours to spare,’ said",48
6951,"the giant, ‘and I will carry you into the neighbourhood of the castle; I",48
6952,must then return to look after the child who is in our care.’,48
6953,,48
6954,"The giant, thereupon, carried the man to within about a hundred leagues",48
6955,"of the castle, where he left him, saying, ‘You will be able to walk the",48
6956,remainder of the way yourself.’ The man journeyed on day and night,48
6957,"till he reached the golden castle of Stromberg. He found it situated,",48
6958,"however, on a glass mountain, and looking up from the foot he saw the",48
6959,enchanted maiden drive round her castle and then go inside. He was,48
6960,"overjoyed to see her, and longed to get to the top of the mountain, but",48
6961,the sides were so slippery that every time he attempted to climb he,48
6962,"fell back again. When he saw that it was impossible to reach her, he was",48
6963,"greatly grieved, and said to himself, ‘I will remain here and wait for",48
6964,"her,’ so he built himself a little hut, and there he sat and watched for",48
6965,"a whole year, and every day he saw the king’s daughter driving round her",48
6966,"castle, but still was unable to get nearer to her.",48
6967,,48
6968,Looking out from his hut one day he saw three robbers fighting and he,48
6969,"called out to them, ‘God be with you.’ They stopped when they heard the",48
6970,"call, but looking round and seeing nobody, they went on again with their",48
6971,"fighting, which now became more furious. ‘God be with you,’ he cried",48
6972,"again, and again they paused and looked about, but seeing no one went",48
6973,"back to their fighting. A third time he called out, ‘God be with you,’",48
6974,and then thinking he should like to know the cause of dispute between,48
6975,"the three men, he went out and asked them why they were fighting so",48
6976,"angrily with one another. One of them said that he had found a stick,",48
6977,and that he had but to strike it against any door through which he,48
6978,"wished to pass, and it immediately flew open. Another told him that he",48
6979,had found a cloak which rendered its wearer invisible; and the third had,48
6980,"caught a horse which would carry its rider over any obstacle, and even",48
6981,up the glass mountain. They had been unable to decide whether they,48
6982,"would keep together and have the things in common, or whether they would",48
6983,"separate. On hearing this, the man said, ‘I will give you something in",48
6984,"exchange for those three things; not money, for that I have not got,",48
6985,"but something that is of far more value. I must first, however, prove",48
6986,whether all you have told me about your three things is true.’ The,48
6987,"robbers, therefore, made him get on the horse, and handed him the stick",48
6988,"and the cloak, and when he had put this round him he was no longer",48
6989,visible. Then he fell upon them with the stick and beat them one after,48
6990,"another, crying, ‘There, you idle vagabonds, you have got what you",48
6991,deserve; are you satisfied now!’,48
6992,,48
6993,After this he rode up the glass mountain. When he reached the gate of,48
6994,"the castle, he found it closed, but he gave it a blow with his stick,",48
6995,and it flew wide open at once and he passed through. He mounted the,48
6996,"steps and entered the room where the maiden was sitting, with a golden",48
6997,goblet full of wine in front of her. She could not see him for he still,48
6998,"wore his cloak. He took the ring which she had given him off his finger,",48
6999,"and threw it into the goblet, so that it rang as it touched the bottom.",48
7000,"‘That is my own ring,’ she exclaimed, ‘and if that is so the man must",48
7001,also be here who is coming to set me free.’,48
7002,,48
7003,"She sought for him about the castle, but could find him nowhere.",48
7004,Meanwhile he had gone outside again and mounted his horse and thrown off,48
7005,"the cloak. When therefore she came to the castle gate she saw him, and",48
7006,cried aloud for joy. Then he dismounted and took her in his arms; and,48
7007,"she kissed him, and said, ‘Now you have indeed set me free, and tomorrow",48
7008,we will celebrate our marriage.’,48
7009,,48
7010,,48
7011,,48
7012,,48
7014,,49
7015,,49
7016,"There was a man who had three sons, the youngest of whom was called",49
7017,"Dummling,[*] and was despised, mocked, and sneered at on every occasion.",49
7018,,49
7019,[*] Simpleton,49
7020,,49
7021,"It happened that the eldest wanted to go into the forest to hew wood,",49
7022,and before he went his mother gave him a beautiful sweet cake and a,49
7023,bottle of wine in order that he might not suffer from hunger or thirst.,49
7024,,49
7025,When he entered the forest he met a little grey-haired old man who bade,49
7026,"him good day, and said: ‘Do give me a piece of cake out of your pocket,",49
7027,and let me have a draught of your wine; I am so hungry and thirsty.’ But,49
7028,"the clever son answered: ‘If I give you my cake and wine, I shall have",49
7029,"none for myself; be off with you,’ and he left the little man standing",49
7030,and went on.,49
7031,,49
7032,"But when he began to hew down a tree, it was not long before he made a",49
7033,"false stroke, and the axe cut him in the arm, so that he had to go home",49
7034,and have it bound up. And this was the little grey man’s doing.,49
7035,,49
7036,"After this the second son went into the forest, and his mother gave him,",49
7037,"like the eldest, a cake and a bottle of wine. The little old grey man",49
7038,"met him likewise, and asked him for a piece of cake and a drink of wine.",49
7039,"But the second son, too, said sensibly enough: ‘What I give you will be",49
7040,taken away from myself; be off!’ and he left the little man standing and,49
7041,"went on. His punishment, however, was not delayed; when he had made a",49
7042,"few blows at the tree he struck himself in the leg, so that he had to be",49
7043,carried home.,49
7044,,49
7045,"Then Dummling said: ‘Father, do let me go and cut wood.’ The father",49
7046,"answered: ‘Your brothers have hurt themselves with it, leave it alone,",49
7047,you do not understand anything about it.’ But Dummling begged so long,49
7048,"that at last he said: ‘Just go then, you will get wiser by hurting",49
7049,yourself.’ His mother gave him a cake made with water and baked in the,49
7050,"cinders, and with it a bottle of sour beer.",49
7051,,49
7052,"When he came to the forest the little old grey man met him likewise,",49
7053,"and greeting him, said: ‘Give me a piece of your cake and a drink out",49
7054,of your bottle; I am so hungry and thirsty.’ Dummling answered: ‘I have,49
7055,"only cinder-cake and sour beer; if that pleases you, we will sit",49
7056,"down and eat.’ So they sat down, and when Dummling pulled out his",49
7057,"cinder-cake, it was a fine sweet cake, and the sour beer had become good",49
7058,"wine. So they ate and drank, and after that the little man said: ‘Since",49
7059,"you have a good heart, and are willing to divide what you have, I will",49
7060,"give you good luck. There stands an old tree, cut it down, and you will",49
7061,find something at the roots.’ Then the little man took leave of him.,49
7062,,49
7063,"Dummling went and cut down the tree, and when it fell there was a goose",49
7064,"sitting in the roots with feathers of pure gold. He lifted her up, and",49
7065,"taking her with him, went to an inn where he thought he would stay the",49
7066,"night. Now the host had three daughters, who saw the goose and were",49
7067,"curious to know what such a wonderful bird might be, and would have",49
7068,liked to have one of its golden feathers.,49
7069,,49
7070,The eldest thought: ‘I shall soon find an opportunity of pulling out a,49
7071,"feather,’ and as soon as Dummling had gone out she seized the goose by",49
7072,"the wing, but her finger and hand remained sticking fast to it.",49
7073,,49
7074,"The second came soon afterwards, thinking only of how she might get a",49
7075,"feather for herself, but she had scarcely touched her sister than she",49
7076,was held fast.,49
7077,,49
7078,"At last the third also came with the like intent, and the others",49
7079,screamed out: ‘Keep away; for goodness’ sake keep away!’ But she did,49
7080,"not understand why she was to keep away. ‘The others are there,’ she",49
7081,"thought, ‘I may as well be there too,’ and ran to them; but as soon as",49
7082,"she had touched her sister, she remained sticking fast to her. So they",49
7083,had to spend the night with the goose.,49
7084,,49
7085,"The next morning Dummling took the goose under his arm and set out,",49
7086,without troubling himself about the three girls who were hanging on to,49
7087,"it. They were obliged to run after him continually, now left, now right,",49
7088,wherever his legs took him.,49
7089,,49
7090,"In the middle of the fields the parson met them, and when he saw the",49
7091,"procession he said: ‘For shame, you good-for-nothing girls, why are you",49
7092,running across the fields after this young man? Is that seemly?’ At the,49
7093,"same time he seized the youngest by the hand in order to pull her away,",49
7094,"but as soon as he touched her he likewise stuck fast, and was himself",49
7095,obliged to run behind.,49
7096,,49
7097,"Before long the sexton came by and saw his master, the parson, running",49
7098,behind three girls. He was astonished at this and called out: ‘Hi!,49
7099,"your reverence, whither away so quickly? Do not forget that we have a",49
7100,"christening today!’ and running after him he took him by the sleeve, but",49
7101,was also held fast to it.,49
7102,,49
7103,"Whilst the five were trotting thus one behind the other, two labourers",49
7104,came with their hoes from the fields; the parson called out to them,49
7105,and begged that they would set him and the sexton free. But they had,49
7106,"scarcely touched the sexton when they were held fast, and now there were",49
7107,seven of them running behind Dummling and the goose.,49
7108,,49
7109,"Soon afterwards he came to a city, where a king ruled who had a daughter",49
7110,who was so serious that no one could make her laugh. So he had put forth,49
7111,a decree that whosoever should be able to make her laugh should marry,49
7112,"her. When Dummling heard this, he went with his goose and all her train",49
7113,"before the king’s daughter, and as soon as she saw the seven people",49
7114,"running on and on, one behind the other, she began to laugh quite",49
7115,"loudly, and as if she would never stop. Thereupon Dummling asked to have",49
7116,"her for his wife; but the king did not like the son-in-law, and made all",49
7117,manner of excuses and said he must first produce a man who could drink,49
7118,"a cellarful of wine. Dummling thought of the little grey man, who could",49
7119,"certainly help him; so he went into the forest, and in the same place",49
7120,"where he had felled the tree, he saw a man sitting, who had a very",49
7121,sorrowful face. Dummling asked him what he was taking to heart so,49
7122,"sorely, and he answered: ‘I have such a great thirst and cannot quench",49
7123,"it; cold water I cannot stand, a barrel of wine I have just emptied, but",49
7124,that to me is like a drop on a hot stone!’,49
7125,,49
7126,"‘There, I can help you,’ said Dummling, ‘just come with me and you shall",49
7127,be satisfied.’,49
7128,,49
7129,"He led him into the king’s cellar, and the man bent over the huge",49
7130,"barrels, and drank and drank till his loins hurt, and before the day was",49
7131,out he had emptied all the barrels. Then Dummling asked once more,49
7132,"for his bride, but the king was vexed that such an ugly fellow, whom",49
7133,"everyone called Dummling, should take away his daughter, and he made a",49
7134,new condition; he must first find a man who could eat a whole mountain,49
7135,"of bread. Dummling did not think long, but went straight into the",49
7136,"forest, where in the same place there sat a man who was tying up his",49
7137,"body with a strap, and making an awful face, and saying: ‘I have eaten a",49
7138,"whole ovenful of rolls, but what good is that when one has such a hunger",49
7139,"as I? My stomach remains empty, and I must tie myself up if I am not to",49
7140,die of hunger.’,49
7141,,49
7142,"At this Dummling was glad, and said: ‘Get up and come with me; you shall",49
7143,eat yourself full.’ He led him to the king’s palace where all the,49
7144,"flour in the whole Kingdom was collected, and from it he caused a huge",49
7145,"mountain of bread to be baked. The man from the forest stood before it,",49
7146,"began to eat, and by the end of one day the whole mountain had vanished.",49
7147,Then Dummling for the third time asked for his bride; but the king again,49
7148,"sought a way out, and ordered a ship which could sail on land and on",49
7149,"water. ‘As soon as you come sailing back in it,’ said he, ‘you shall",49
7150,have my daughter for wife.’,49
7151,,49
7152,"Dummling went straight into the forest, and there sat the little grey",49
7153,"man to whom he had given his cake. When he heard what Dummling wanted,",49
7154,"he said: ‘Since you have given me to eat and to drink, I will give you",49
7155,the ship; and I do all this because you once were kind to me.’ Then he,49
7156,"gave him the ship which could sail on land and water, and when the king",49
7157,"saw that, he could no longer prevent him from having his daughter. The",49
7158,"wedding was celebrated, and after the king’s death, Dummling inherited",49
7159,his kingdom and lived for a long time contentedly with his wife.,49
7160,,49
7161,,49
7162,,49
7163,,49
7165,,50
7166,,50
7167,"Long before you or I were born, there reigned, in a country a great way",50
7168,"off, a king who had three sons. This king once fell very ill--so ill",50
7169,that nobody thought he could live. His sons were very much grieved,50
7170,at their father’s sickness; and as they were walking together very,50
7171,"mournfully in the garden of the palace, a little old man met them and",50
7172,"asked what was the matter. They told him that their father was very ill,",50
7173,"and that they were afraid nothing could save him. ‘I know what would,’",50
7174,said the little old man; ‘it is the Water of Life. If he could have a,50
7175,draught of it he would be well again; but it is very hard to get.’ Then,50
7176,"the eldest son said, ‘I will soon find it’: and he went to the sick",50
7177,"king, and begged that he might go in search of the Water of Life, as",50
7178,"it was the only thing that could save him. ‘No,’ said the king. ‘I had",50
7179,rather die than place you in such great danger as you must meet with in,50
7180,your journey.’ But he begged so hard that the king let him go; and the,50
7181,"prince thought to himself, ‘If I bring my father this water, he will",50
7182,make me sole heir to his kingdom.’,50
7183,,50
7184,Then he set out: and when he had gone on his way some time he came to a,50
7185,"deep valley, overhung with rocks and woods; and as he looked around, he",50
7186,"saw standing above him on one of the rocks a little ugly dwarf, with a",50
7187,"sugarloaf cap and a scarlet cloak; and the dwarf called to him and said,",50
7188,"‘Prince, whither so fast?’ ‘What is that to thee, you ugly imp?’ said",50
7189,"the prince haughtily, and rode on.",50
7190,,50
7191,"But the dwarf was enraged at his behaviour, and laid a fairy spell",50
7192,of ill-luck upon him; so that as he rode on the mountain pass became,50
7193,"narrower and narrower, and at last the way was so straitened that he",50
7194,could not go to step forward: and when he thought to have turned his,50
7195,"horse round and go back the way he came, he heard a loud laugh ringing",50
7196,"round him, and found that the path was closed behind him, so that he was",50
7197,shut in all round. He next tried to get off his horse and make his way,50
7198,"on foot, but again the laugh rang in his ears, and he found himself",50
7199,"unable to move a step, and thus he was forced to abide spellbound.",50
7200,,50
7201,Meantime the old king was lingering on in daily hope of his son’s,50
7202,"return, till at last the second son said, ‘Father, I will go in search",50
7203,"of the Water of Life.’ For he thought to himself, ‘My brother is surely",50
7204,"dead, and the kingdom will fall to me if I find the water.’ The king was",50
7205,"at first very unwilling to let him go, but at last yielded to his wish.",50
7206,"So he set out and followed the same road which his brother had done,",50
7207,"and met with the same elf, who stopped him at the same spot in the",50
7208,"mountains, saying, as before, ‘Prince, prince, whither so fast?’ ‘Mind",50
7209,"your own affairs, busybody!’ said the prince scornfully, and rode on.",50
7210,,50
7211,But the dwarf put the same spell upon him as he put on his elder,50
7212,"brother, and he, too, was at last obliged to take up his abode in the",50
